book_name,author,number_of_reviews,rating(5),publishing_house,year_of_publication,bookbinding,quantity_of_pages,language,quantity_of_ratings_5,quantity_of_ratings_4,quantity_of_ratings_3,quantity_of_ratings_2,quantity_of_ratings_1
Гибкое сознание. Новый взгляд на психологию развития взрослых и детей, Кэрол Дуэк,6,4.2,"Манн, Иванов и Фербер",2020,твердый переплет,304,Русский,3,2,0,1,0
Подставка для книг «Планеты»,,,,,,,,,,,,,
Динозавры, Р. Ферт,155,4.9,Росмэн,2012,твердый переплет,46,Русский,151,2,1,0,1
Полный курс кройки и шитья. Конструирование модной одежды. Преобразование выкройки-основы, Т. Жилевска,14,4.8,Эксмо,2017,твердый переплет,348,Русский,12,1,1,0,0
Все приключения Незнайки, Н. Н. Носов,13,4.7,Росмэн,2018,твердый переплет,,Русский,10,2,1,0,0
После, А. Тодд,2,5,Эксмо,2019,мягкая обложка,592,Русский,2,0,0,0,0
Путь к финансовой свободе, Б. Шефер,,,Попурри,2020,мягкая обложка,336,мягкая обложка,,,,,
По ком звонит колокол, Э. М. Хемингуэй,4,5,АСТ,2016,мягкая обложка,704,Русский,4,0,0,0,0
Утреннее сияние, С. Джио,13,4.8,Эксмо,2018,мягкая обложка,416,Русский,11,2,0,0,0
Творец Заклинаний, С. де Кастелл,10,4.9,Эксмо,2018,твердый переплет,480,Русский,9,1,0,0,0
"Автостопом по Галактике. Ресторан ""У конца Вселенной""", Д. Адамс,26,4.7,АСТ,2014,мягкая обложка,320,Русский,23,0,1,1,1
Большая книга тайн для мальчиков," С. С. Пирожник, А. Г. Мерников",29,5,АСТ,2015,твердый переплет,208,Русский,29,0,0,0,0
Загадка закрытого ящика, Х. Вебб,49,5,Эксмо,2016,твердый переплет,224,Русский,48,1,0,0,0
Куриный бульон для души. 101 лучшая история," М. В. Хансен, Дж. Кэнфилд",90,4.7,Эксмо,2016,мягкая обложка,352,Русский,73,8,7,2,0
"Человек, который смеется", В. Гюго,5,4.8,АСТ,2015,мягкая обложка,704,Русский,4,1,0,0,0
"Кафе на краю земли. Как перестать плыть по течению и вспомнить, зачем ты живешь",,10,4.6,Эксмо,2018,интегральный переплет,160,Русский,9,0,0,0,1
Пропавший изумруд, Х. Вебб,17,5,Эксмо,2016,твердый переплет,224,Русский,17,0,0,0,0
Благие знамения," Т. Пратчетт, Н. Гейман",13,5,Эксмо,2019,твердый переплет,512,Русский,13,0,0,0,0
Альбом целительных аффирмаций для раскрашивания и отдыха, Л. Хей,19,4.8,Эксмо,2016,мягкая обложка,96,Русский,17,1,1,0,0
Методика раннего развития Глена Домана. От 0 до 4 лет,,20,4.6,Эксмо,2013,твердый переплет,224,Русский,14,4,2,0,0
Бремя страстей человеческих, У. С. Моэм,9,4.9,АСТ,2015,мягкая обложка,800,Русский,8,1,0,0,0
Рискуя собственной шкурой. Скрытая асимметрия повседневной жизни, Талеб Н.Н.,4,4.5,Иностранка / КоЛибри,2018,твердый переплет,384,Русский,3,0,1,0,0
Магия утра. Ежедневник," Хэл Элрод, Х. Кордер, Н. Джанджи",7,4.7,"Манн, Иванов и Фербер",2018,мягкая обложка,208,Русский,6,0,1,0,0
На пределе. Неделя без жалости к себе, Э. Ларссен,27,4.6,"Манн, Иванов и Фербер",2019,мягкая обложка,208,Русский,23,1,0,1,2
"Карма и Радикальное Прощение: Пробуждение к сознанию о том, кто ты есть", К. Типпинг,3,5,София,2019,мягкая обложка,224,Русский,3,0,0,0,0
Алая королева, Авеярд В.,3,5,Freedom,2019,твердый переплет,544,Русский,3,0,0,0,0
Карта мира для детей,,81,4.3,БЕЛЛСИ,2014,мягкая обложка,1,Русский,48,18,8,4,3
"Как общаться с трудными людьми. Слышать, понимать, договариваться и справляться с эмоциями", М. Эннесли,,,Альпина Паблишер,2020,твердый переплет,192,Русский,,,,,
Чертоги разума, А. В. Курпатов,6,5,Капитал,2018,твердый переплет,416,Русский,6,0,0,0,0
Умные игры с картами. Английские неправильные глаголы. Уровень 1, П. А. Степичев,6,5,Айрис-пресс,2018,89x116/17,,Английский-Русский,6,0,0,0,0
Унесенные ветром. Том 1, М. Митчелл,6,5,Эксмо,2020,твердый переплет,640,Русский,6,0,0,0,0
Pop up энциклопедия. Живая планета. Моря и океаны (книжка-панорамка),,2,5,Malamalama,2019,переплет из картона,,Русский,2,0,0,0,0
Уроки чистописания и грамотности. Обучающие прописи, Н. С. Жукова,57,5,Эксмо,2013,мягкая обложка,120,Русский,56,0,1,0,0
Как научиться учиться. Навыки осознанного усвоения знаний, У. Бозер,,,Альпина Паблишер,2020,твердый переплет,368,Русский,,,,,
Всё та же я, Дж. Мойес,39,4.8,Иностранка,2020,твердый переплет,576,Русский,36,1,1,1,0
Среди тысячи лиц, С. Джио,34,4.8,Эксмо,2017,твердый переплет,352,Русский,31,2,0,0,1
Закон высоких девушек, Дж. Макгрегор,4,5,Like Book,2019,твердый переплет,352,Русский,4,0,0,0,0
Продажное королевство, Л. Бардуго,11,5,АСТ,2018,твердый переплет,672,Русский,11,0,0,0,0
100 окошек - открывай-ка!,,46,4.8,Эксмо,2014,твердый переплет,24,Русский,40,4,2,0,0
Тошнота, Ж.-П. Сартр,6,4.5,АСТ,2013,мягкая обложка,320,Русский,4,1,1,0,0
Дневники Вишенки. Том 1. Каменный зоопарк, Ж. Шамблен,18,5,"Манн, Иванов и Фербер",2017,твердый переплет,80,Русский,18,0,0,0,0
Большая книга сказок для малышей, Коллектив авторов,2,5,Росмэн,2019,твердый переплет,,Русский,2,0,0,0,0
25 Days to a Better English. Grammar," Е. В. Макарова, Пархамович Т.В.",2,4.5,Попурри,2019,мягкая обложка,80,сборники заданий и упражнений,1,1,0,0,0
Маленький принц. Pre-Intermediate, А. де Сент-Экзюпери,2,5,АСТ,2019,мягкая обложка,320,Английский,2,0,0,0,0
Сказки на ночь для юных бунтарок. 100 вдохновляющих историй о невероятных женщинах," Ф. Кавальо, Е. Фавильи",36,4.9,Эксмо,2018,твердый переплет,224,Русский,35,0,1,0,0
Ходячий замок, Д. У. Джонс,35,4.9,Азбука,2012,твердый переплет,448,Русский,33,1,1,0,0
Фонарик для чтения «Android»,,8,4.6,,,,,,,,,6,1
"1 класс. Обучение грамоте. Рабочие тетради №1, 2", Коллектив авторов,25,5,Алматыкiтап (Алматыкитап),2019,мягкая обложка,108,рабочие тетради,25,0,0,0,0
Школа Жуковой «Развитие речи», М. А. Жукова,1,5,УМка,2017,твердый переплет,,Русский,1,0,0,0,0
Потому что я тебя люблю, Г. Мюссо,35,4.5,Эксмо,2018,мягкая обложка,384,Русский,30,0,1,2,2
Как научить ребенка учиться, К. Вордерман,3,4.3,"Манн, Иванов и Фербер",2017,интегральный переплет,256,Русский,2,0,1,0,0
До встречи с тобой, Дж. Мойес,222,4.9,Иностранка,2013,твердый переплет,480,Русский,203,10,7,2,0
Краткие ответы на большие вопросы, С. Хокинг,6,5,Эксмо,2018,твердый переплет,256,Русский,6,0,0,0,0
Вино из одуванчиков, Р. Брэдбери,29,4.2,Эксмо,2017,твердый переплет,320,Русский,20,2,2,2,3
Гордость и предубеждение. Уникальная методика обучения языку В. Ратке, Д. Остин,21,5,АСТ,2017,мягкая обложка,320,Английский,20,1,0,0,0
"Отец. Как воспитать чемпионов в спорте, бизнесе и жизни"," И. В. Рыбаков, А. Нурмагомедов",,,АСТ,2019,твердый переплет,256,Русский,,,,,
30000 примеров по математике. 2 класс," О. В. Узорова, Е. А. Нефедова",4,5,АСТ,2018,мягкая обложка,128,Русский,4,0,0,0,0
Гордость и предубеждение, Дж. Остен,1,5,Эксмо,2019,мягкая обложка,416,Русский,1,0,0,0,0
"Думай и богатей! Самое полное издание, исправленное и дополненное", Н. Хилл,14,4.9,АСТ,2019,мягкая обложка,384,Русский,13,1,0,0,0
Цель. Процесс непрерывного улучшения, Э. Голдратт,2,5,Попурри,2019,твердый переплет,400,Русский,2,0,0,0,0
Жестокий век, И. К. Калашников,12,4.8,АСТ,2018,интегральный переплет,864,Русский,10,2,0,0,0
До встречи с тобой, Дж. Мойес,8,5,Иностранка,2019,мягкая обложка,480,Русский,8,0,0,0,0
Зачем мы спим. Новая наука о сне и сновидениях, М. Уолкер,7,5,Азбука-Аттикус,2018,твердый переплет,480,Русский,7,0,0,0,0
Полный курс немецкого языка,,51,5,АСТ,2015,мягкая обложка,512,Русский,49,2,0,0,0
Хрестоматия. 2 класс,,31,4.9,Самовар,2014,твердый переплет,320,Русский,29,2,0,0,0
Самая полная книга-тренажер для развития мозга! Новые тренинги для ума, А. Могучий,27,4.7,АСТ,2015,твердый переплет,448,Русский,24,1,0,1,1
"Как объяснить ребенку науку. Иллюстрированный справочник для родителей по биологии, химии и физике", К. Вордерман,3,5,"Манн, Иванов и Фербер",2016,интегральный переплет,,Русский,3,0,0,0,0
Али и Нино, Курбан С.,26,4.5,Азбука,2017,мягкая обложка,320,Русский,20,2,2,0,2
"Давай поговорим про ЭТО: о девочках, мальчиках, младенцах, семьях и теле", Р. Харрис,10,4.8,Эксмо,2016,твердый переплет,64,Русский,9,0,1,0,0
"Вальс гормонов. Вес, сон, секс, красота и здоровье как по нотам", Н. А. Зубарева,182,4.8,АСТ,2017,твердый переплет,352,Русский,165,5,6,1,5
Психология влияния, Р. Б. Чалдини,2,5,Питер,2019,мягкая обложка,480,Русский,2,0,0,0,0
Скорочтение. 200 текстов, М. А. Жукова,2,5,УМка,2019,твердый переплет,,офсет,2,0,0,0,0
"Твоя вторая жизнь, или книга о счастье", Р. Джордано,133,4.8,Эксмо,2016,мягкая обложка,320,Русский,118,7,4,3,1
Мне тебя обещали, Э. Сафарли,42,4,АСТ,2015,мягкая обложка,288,Русский,26,5,3,2,6
"Возлюби болезнь свою. Как стать здоровым, познав радость жизни", В. В. Синельников,24,5,Центрполиграф,2020,мягкая обложка,249,Русский,24,0,0,0,0
Ворон, Д. О'Барр,1,5,Азбука,2020,твердый переплет,280,Русский,1,0,0,0,0
"Выживи, сынок", П. Ятай,29,4.9,Амфора,2010,мягкая обложка,287,Русский,28,0,1,0,0
Джекаби. Все мистические расследования, У. Риттер,,,АСТ,2020,твердый переплет,832,Русский,,,,,
Маленький принц, А. де Сент-Экзюпери,19,4.9,Эксмо,2011,твердый переплет,104,Русский,18,0,1,0,0
После ссоры, А. Тодд,6,4.5,Эксмо,2016,мягкая обложка,736,Русский,5,0,0,1,0
Комплект занимательных карточек по обучению грамоте, А. А. Штец,4,5,Айрис-пресс,2020,мягкая обложка,288,Русский,4,0,0,0,0
Капитал: критика политической экономии. Том I, К. Маркс,4,4.8,Эксмо,2017,твердый переплет,1200,Русский,3,1,0,0,0
"Главное в истории искусств. Ключевые работы, темы, направления, техники", С. Ходж,5,5,"Манн, Иванов и Фербер",2018,твердый переплет,,Русский,5,0,0,0,0
Властелин колец, Дж. Р. Р. Толкин,46,5,АСТ,2016,твердый переплет,1696,Русский,45,1,0,0,0
"Еда и мозг на практике. Программа для развития мозга, снижения веса и укрепления здоровья"," К. Лоберг, Д. Перлмуттер",4,5,"Манн, Иванов и Фербер",2018,мягкая обложка,288,Русский,4,0,0,0,0
Гравити Фолз. Счастливого Летоуина. Супермаркет ужасов,,2,5,Эксмо,2019,твердый переплет,64,Русский,2,0,0,0,0
Разбуди в себе исполина, Т. Роббинс,,,Попурри,2019,твердый переплет,576,Русский,,,,,
Северное сияние, Ф. Пулман,21,5,АСТ,2016,суперобложка,416,Русский,21,0,0,0,0
The One. Единственный, Д. Маррс,4,5,Эксмо,2020,твердый переплет,416,Русский,4,0,0,0,0
Расскажи мне о море, Э. Сафарли,60,4.6,АСТ,2016,твердый переплет,320,Русский,49,6,2,0,3
Исцеляющая сила мысли, Л. Хей,16,5,Эксмо,2016,мягкая обложка,448,Русский,16,0,0,0,0
Научись читать по-английски, Л. Камионская,3,5,Феникс,2020,мягкая обложка,109,Русский,3,0,0,0,0
Преступление и наказание, Ф. М. Достоевский,23,4.7,Азбука,2018,твердый переплет,608,Русский,20,1,1,1,0
Психология влияния, Р. Б. Чалдини,1,5,Питер,2019,твердый переплет,336,Русский,1,0,0,0,0
Даты и судьбы. Большая книга нумерологии, А. Ф. Александров,3,4.7,РИПОЛ классик,2017,твердый переплет,,Русский,2,1,0,0,0
Внутри убийцы, М. Омер,8,4.9,Эксмо,2019,твердый переплет,416,Русский,7,1,0,0,0
Политическая карта Мира (101х70 см),,54,4.9,,,,,,,,,50,2
Хрестоматия. 3-4 классы,,35,5,Самовар,2011,твердый переплет,320,Русский,34,1,0,0,0
Идиот, Ф. М. Достоевский,30,5,Азбука,2018,твердый переплет,640,Русский,29,1,0,0,0
Дюна, Ф. Герберт,,,АСТ,2020,мягкая обложка,800,Русский,,,,,
Как помочь ребенку повзрослеть. Иллюстрированное руководство для родителей по переходному возрасту, Р. Уинстон,4,4.8,"Манн, Иванов и Фербер",2018,интегральный переплет,244,Русский,3,1,0,0,0
Моя геройская академия. Книга 3, К. Хорикоси,1,5,Азбука,2020,твердый переплет,392,Русский,1,0,0,0,0
Как заставить работать мозг в любом возрасте. Японская система развития интеллекта и памяти, Р. Кавашима,7,4.6,Питер,2019,мягкая обложка,160,Русский,5,1,1,0,0
"Тук-тук, сердце! Как подружиться с самым неутомимым органом и что будет, если этого не сделать", Й. Х. Борстель,13,5,Эксмо,2016,твердый переплет,256,Русский,13,0,0,0,0
Тайна мальчика из джунглей, Х. Вебб,12,5,Эксмо,2016,твердый переплет,224,Русский,12,0,0,0,0
Сорок правил любви, Э. Шафак,42,4.6,Азбука,2015,мягкая обложка,416,Русский,36,0,4,1,1
"Теряя невинность. Как я построил бизнес, делая все по-своему и получая удовольствие от жизни", Р. Брэнсон,5,5,Альпина Паблишер,2019,мягкая обложка,552,Русский,5,0,0,0,0
Альбом по развитию речи для самых маленьких," Е. Савостьянова, С. В. Батяева",374,4.9,Росмэн,2017,мягкая обложка,88,Русский,347,24,1,1,1
"Другая книга, которой нет. 20 наиболее эффективных инструментов саморазвития", А.  Новак,9,4.8,Питер,2019,интегральный переплет,176,Русский,7,2,0,0,0
Amazon. От офиса в гараже до $10 млрд годового дохода," Н. Берг, М. Найтс",,,Бомбора,2020,твердый переплет,336,Русский,,,,,
Сияние = The Shining, С. Э. Кинг,7,4.9,АСТ,2018,мягкая обложка,480,Английский,6,1,0,0,0
Зеленая миля, С. Э. Кинг,69,4.9,Астрель,2012,твердый переплет,381,Русский,64,3,2,0,0
"Как влиять на людей и выработать уверенность в себе, выступая публично", Д. Карнеги,2,5,АСТ,2019,твердый переплет,256,Русский,2,0,0,0,0
Стартап: Настольная книга основателя. Пошаговое руководство по построению великой компании с нуля," С. Бланк, Б. Дорф",3,5,Альпина Паблишер,2020,твердый переплет,624,Русский,3,0,0,0,0
Уличный кот по имени Боб. Как человек и кот обрели надежду на улицах Лондона," Дж. Боуэн, Г. Дженкинс",49,4.8,РИПОЛ классик,2018,твердый переплет,384,Русский,45,1,2,1,0
Бегущий в Лабиринте, Дж. Дэшнер,33,4.9,АСТ,2014,твердый переплет,448,Русский,31,1,1,0,0
Нейропсихологические занятия с детьми. Часть 1," С. Н. Колганов, В. С. Колганова, Е. В. Пивоварова",22,4.9,Айрис-пресс,2014,мягкая обложка,416,Русский,19,3,0,0,0
Сказки братьев Гримм. Читаю сам, Братья Гримм,,,Проф-Пресс,2016,твердый переплет,32,Русский,,,,,
Икигай. Смысл жизни по-японски, К. Моги,8,3.8,КоЛибри,2018,твердый переплет,192,Русский,4,0,2,2,0
Поющие в терновнике, К. Маккалоу,4,4.8,АСТ,2017,твердый переплет,640,Русский,3,1,0,0,0
Жареные зеленые помидоры в кафе «Полустанок», Ф. Флэгг,13,5,Фантом Пресс,2018,твердый переплет,416,Русский,13,0,0,0,0
Гарри Поттер и Тайная комната, Дж. К. Роулинг,22,4,Махаон,2014,твердый переплет,480,Русский,14,2,1,1,4
Сказки на каждый вечер, Братья Гримм,31,4.5,Росмэн,2012,твердый переплет,144,Русский,23,5,1,1,1
Интенсивный курс немецкого языка для начинающих, Д. А. Листвин,9,5,АСТ,2018,мягкая обложка,416,Русский-Немецкий,9,0,0,0,0
Полный годовой курс для занятий с детьми 1-2 лет, Д. Денисова,66,4.8,Мозаика-Синтез,2017,мягкая обложка,,от 1 до 3 лет,59,4,1,1,1
Сказки барда Бидля, Дж. К. Роулинг,15,4.7,Махаон,2017,твердый переплет,136,Русский,12,2,1,0,0
Маленький принц, А. де Сент-Экзюпери,1,2,АСТ,2019,мягкая обложка,224,Русский,0,0,0,1,0
Большая книга японских узоров. 260 необычных схем для вязания спицами," Х. Шида, Г. Рем",73,5,"Манн, Иванов и Фербер",2018,твердый переплет,160,Русский,73,0,0,0,0
"280 дней до вашего рождения. Репортаж о том, что вы забыли, находясь в эпицентре событий", К. Вестре,7,5,Бомбора,2019,твердый переплет,208,Русский,7,0,0,0,0
Сила Настоящего, Э. Толле,19,4.6,София,2019,мягкая обложка,256,Русский,17,0,0,0,2
Большой альбом по развитию речи, С. В. Батяева,79,5,Росмэн,2017,интегральный переплет,,Русский,76,3,0,0,0
"Мне 10 лет, и я разведена"," Д. Минуи, Н. Али",2,4,Бомбора,2020,мягкая обложка,208,типографская,1,0,1,0,0
Чизкейк внутри. Книга вторая, В. Мельник,54,5,ХлебСоль,2018,твердый переплет,128,Русский,52,2,0,0,0
Тайная опора. Привязанность в жизни ребенка, Л. В. Петрановская,49,5,АСТ,2014,твердый переплет,288,Русский,47,2,0,0,0
Годовой курс развивающих занятий: для детей 3-4 лет, Н. В. Володина,2,5,Эксмо,2019,твердый переплет,296,3-4 лет,2,0,0,0,0
"Мама, как же ты будешь дальше любить меня?", Х. Хейди,2,5,Фолиант,2019,мягкая обложка,36,Русский,2,0,0,0,0
Тренажер по исправлению почерка на основе росчерков и скорописи для старшеклассников. 1 ступень, Л. Е. Тарасова,13,4.9,5 за знания,52018,мягкая обложка,32,Русский,12,1,0,0,0
Самостоятельные дети. Как ослабить контроль и научить ребенка управлять собственной жизнью," У. Стиксруд, Н. Джонсон",,,"Манн, Иванов и Фербер",2020,твердый переплет,464,Русский,,,,,
MBA в кармане. Практическое руководство по развитию ключевых навыков управления," Томас Н., Пирсон Б.",4,5,Альпина Паблишер,2019,твердый переплет,334,Русский,4,0,0,0,0
Первая после Букваря книга для чтения, Н. С. Жукова,49,4.6,Эксмо,2012,твердый переплет,80,Русский,37,4,6,2,0
Кэрри, С. Э. Кинг,29,4.7,АСТ,2013,твердый переплет,320,Русский,23,2,4,0,0
"Просто космос. Практикум по Agile-жизни, наполненной смыслом и энергией", К. Ленгольд,9,5,"Манн, Иванов и Фербер",2018,твердый переплет,160,Русский,9,0,0,0,0
Джейн Эйр, Ш. Бронте,22,4.9,Эксмо,2018,твердый переплет,512,Русский,20,2,0,0,0
